B3: AUG ITEM | C3: Date | D3: Comments | E3: Bleeder | F3: Ferret | G3: Rodman | H3: rewD | I3: Wango | J3: Newbie | K3: Totals
B4: AUG.soc Domain | C4: 37104 | D4: $35 annual fee via new.net | E4: 7 | F4: 7 | G4: 7 | H4: 7 | I4: 7 | K4: =SUM(E4:J4) -> 35
B5: Pool of AUG 2001 Entry Fee | C5: 37135 | D5: $1 per week for 17 week season | E5: 17 | F5: 17 | G5: 17 | H5: 17 | I5: 17 | K5: =SUM(E5:J5) -> 85
B6: AUGSociety.com Domain | C6: 37470 | D6: $35 annual fee via yahoo.com | E6: 7 | F6: 7 | G6: 7 | H6: 7 | I6: 7 | K6: =SUM(E6:J6) -> 35
B7: Pool of AUG 2002 Entry Fee | C7: 37501 | D7: $1 per week for 17 week season | E7: 17 | F7: 17 | G7: 17 | H7: 17 | I7: 17 | K7: =SUM(E7:J7) -> 85
B8: AUGSociety.com Domain | C8: 37835 | D8: $35 annual fee via yahoo.com | E8: 7 | F8: 7 | G8: 7 | H8: 7 | I8: 7 | K8: =SUM(E8:J8) -> 35
B9: Pool of AUG 2003 Entry Fee | C9: 37866 | D9: $1 per week for 17 week season | E9: 17 | F9: 17 | G9: 17 | H9: 17 | I9: 17 | K9: =SUM(E9:J9) -> 85
B10: AUGSociety.com Domain | C10: 38202 | D10: $36 annual fee via yahoo.com | E10: 6 | F10: 6 | G10: 6 | H10: 6 | I10: 6 | J10: 6 | K10: =SUM(E10:J10) -> 36
B11: AUGSociety.com Domain | C11: 38567 | D11: $36 annual fee via yahoo.com | E11: 6 | F11: 6 | G11: 6 | H11: 6 | I11: 6 | J11: 6 | K11: =SUM(E11:J11) -> 36
B12: AUGSociety.com Domain | C12: 38932 | D12: $36 annual fee via yahoo.com | E12: 6 | F12: 6 | G12: 6 | H12: 6 | I12: 6 | J12: 6 | K12: =SUM(E12:J12) -> 36
B13: Loyd Park reservation | C13: 39203 | D13: $30 campground reservation | E13: 5 | F13: 5 | G13: 5 | H13: 5 | I13: 5 | J13: 5 | K13: =SUM(E13:J13) -> 30
B14: AUGSociety.com Domain | C14: 39297 | D14: $36 annual fee via yahoo.com | E14: 6 | F14: 6 | G14: 6 | H14: 6 | I14: 6 | J14: 6 | K14: =SUM(E14:J14) -> 36
B15: Total Debits | C15: 37990 | D15: sum of the above | E15: =SUM(E4:E14) -> 101 | F15: =SUM(F4:F14) -> 101 | G15: =SUM(G4:G14) -> 101 | H15: =SUM(H4:H14) -> 101 | I15: =SUM(I4:I14) -> 101 | J15: =SUM(J4:J14) -> 29 | K15: =SUM(E15:J15) -> 534
B16: Pool of AUG 2001 Winnings | C16: 37226 | D16: # of weeks won times $5 | E16: 30 | F16: 20 | G16: 20 | H16: 15 | I16: 0 | J16: 0 | K16: =SUM(E16:J16) -> 85
B17: Pool of AUG 2002 Winnings | C17: 37592 | D17: weekly wins + year-end grand prizes | E17: 43 | F17: 6 | G17: 16 | H17: 20 | I17: 0 | J17: 0 | K17: =SUM(E17:J17) -> 85
B18: Drinkin Pee wit T.A.C. Credits | C18: 37775 | D18: payments received - thank you | E18: -25 | F18: 22 | G18: 12 | H18: -26 | I18: 17 | J18: 0 | K18: =SUM(E18:J18) -> 0
B19: Pool of AUG 2003 Winnings | C19: 37958 | D19: weekly wins + year-end grand prizes | E19: 40 | F19: 22 | G19: 6 | H19: 14 | I19: 3 | J19: 0 | K19: =SUM(E19:J19) -> 85
B20: Miscellaneous Credits | C20: --- | D20: payments received - thank you | E20: 0 | F20: 2 | G20: 0 | H20: =35+35+35+36+36+36+36+30-2-31 -> 246 | I20: 31 | J20: 0 | K20: =SUM(E20:J20) -> 279
B21: Balance | C21: 37836 | D21: If negative then you owe | E21: =SUM(E16:E20)-E15 -> -13 | F21: =SUM(F16:F20)-F15 -> -29 | G21: =SUM(G16:G20)-G15 -> -47 | H21: =SUM(H16:H20)-H15 -> 168 | I21: =SUM(I16:I20)-I15 -> -50 | J21: =SUM(J16:J20)-J15 -> -29 | K21: =SUM(E21:J21) -> 0
B24: Notes on payments received:
B25: Wango mailed a $31 check to the home office in August, 2002
B26: Rewd paid web fees ('01 to '07) = $178, '07 camping fees & $2 Ferret debt
B27: Ferret forgiven $2 debt for courageous conduct unbecoming an AUGster